{
  "schemaName": "lcim.common.enums",
  "schemaVersion": "2.0.0",
  "workerStatus": ["WORK_COMPLETE", "BLOCKED", "FAILED", "NO_CHANGE"],
  "controllerDisposition": ["PATCH_VALID", "SEMANTICALLY_ACCEPTED", "CANDIDATE_INTEGRATED", "REVIEW_APPROVED", "REJECTED", "REVIEW_REQUIRED"],
  "runStatus": ["OPEN", "COMPLETED", "INCOMPLETE_LEDGER", "ABORTED"],
  "invocationEventKind": ["START", "COMPLETION", "ASSESSMENT", "RECONCILIATION"],
  "workUnitStatus": ["CREATED", "IN_PROGRESS", "BLOCKED", "COMPLETED", "FAILED"],
  "reviewFindingSeverity": ["INFO", "WARNING", "CRITICAL"],
  "rejectionCode": ["TRANSPORT_MALFORMED", "SCHEMA_MISMATCH", "SEMANTIC_CONFLATION", "WRONG_BASE", "SCOPE_VIOLATION", "UNRESOLVED_SEMANTICS", "UNSUPPORTED_CLAIM", "INCOMPLETE_LEDGER", "BUDGET_EXHAUSTED", "SECRET_DENIED_PATH", "SOL_ASK_INVALID"]
}
